{
  "_meta": {
    "generated_at": "2026-04-30T14:00:00Z",
    "valid_until": "2026-04-30T22:00:00Z",
    "pack_name": "Eng Platform Briefing",
    "schema_version": "1.0.0"
  },
  "service_owners": {
    "atlas-payments": { "team": "Payments", "tech_lead": "Alex Park", "slack_channel": "#atlas-eng" },
    "auth-proxy": { "team": "Identity", "tech_lead": "Riley Tan", "slack_channel": "#identity" },
    "mobilekit": { "team": "Mobile", "tech_lead": "Sam Rivera", "slack_channel": "#mobile-sdk" }
  },
  "oncall_rotation": {
    "primary": "Quinn Park",
    "secondary": "Pat Quinn",
    "rotation_id": "platform-2026-w18"
  },
  "deploy_status": {
    "atlas-payments": { "version": "4.1.2", "last_deploy": "2026-04-29T18:30:00Z", "status": "healthy" },
    "auth-proxy": { "version": "2.7.0", "last_deploy": "2026-04-28T11:00:00Z", "status": "healthy" }
  },
  "feature_flags": [
    { "name": "atlas_v4_routing", "state": "enabled", "rollout_pct": 100 },
    { "name": "mobilekit_offline_mode", "state": "ramping", "rollout_pct": 35 }
  ],
  "internal_api_versions": {
    "atlas_payments_sdk": "4.1.2",
    "mobilekit": "4.2.0",
    "auth_proxy_grpc": "2.7.0"
  },
  "active_incidents": [],
  "corrections": [
    { "wrong": "atlas v3 routing is current", "right": "atlas v4 routing has been at 100% since 2026-03-14. v3 is removed.", "context": "platform migration" }
  ]
}
